title,link,snippet
Character-LLM: A Trainable Agent for Role-Playing,https://aclanthology.org/2023.emnlp-main.814,"Large language models (LLMs) can be used to serve as agents to simulate human behaviors, given the powerful ability to understand human instructions and provide ..."
LLM-Blender: Ensembling Large Language Models with ...,https://aclanthology.org/2023.acl-long.792,"We present LLM-Blender, an ensembling framework designed to attain consistently superior performance by leveraging the diverse strengths of multiple open-source ..."
Large Language Models Can Self-Improve,https://aclanthology.org/2023.emnlp-main.67,"Abstract. Large Language Models (LLMs) have achieved excellent performances in various tasks. However, fine-tuning an LLM requires extensive supervision."
Can Large Language Models Be an Alternative to Human ...,https://aclanthology.org/2023.acl-long.870,We use human evaluation and LLM evaluation to evaluate the texts in two NLP tasks: open-ended story generation and adversarial attacks. We show that the result ...
NLP Evaluation in trouble: On the Need to Measure LLM ...,https://aclanthology.org/2023.findings-emnlp.722,Abstract. In this position paper we argue that the classical evaluation on Natural Language Processing (NLP) tasks using annotated benchmarks is in trouble.
The Internal State of an LLM Knows When It's Lying,https://aclanthology.org/2023.findings-emnlp.68.pdf,"While Large Language Models (LLMs) have shown exceptional performance in various tasks, one of their most prominent drawbacks."
Towards LLM-based Fact Verification on News Claims with ...,https://aclanthology.org/2023.ijcnlp-main.64.pdf,"We investigate the ability of LLMs with ICL for news claim verification. And we find that with only four-shot demonstration examples, LLMs can outperform most ..."
LLM-Eval: Unified Multi-Dimensional Automatic Evaluation ...,https://aclanthology.org/2023.nlp4convai-1.5,no_snipped
Coupling Large Language Models with Logic ...,https://aclanthology.org/2023.findings-acl.321,"While large language models (LLMs), such as GPT-3, appear to be robust and general, their reasoning ability is not at a level to compete with the best models ..."
